id,text,source_forum,timestamp,language,cleaned_text,keywords,risk_score,dominant_topic,label,threat_type,is_anomaly,anomaly_score
post_1454,leak from hospital 500k records includes account,breachforums,2024-03-07 19:13:00,en,leak hospital 500k record include account,leak,0.2,0,credential_leak,credential_leak,False,0.026903170517401
post_1455,fresh credential dump 200k records government usdt accepted,exploit_in,2024-05-02 12:58:00,en,fresh credential dump 200k record government usdt accept,"credential,dump",0.4,3,credential_leak,credential_leak,False,0.0220368069259609
post_1457,leak from social media 100k records includes credit card,darknetlive,2024-01-24 08:16:00,en,leak social medium 100k record include credit card,leak,0.2,0,credential_leak,credential_leak,False,0.0206347512788747
post_1458,leak from major bank 200k records includes ssn,exploit_in,2024-06-27 20:05:00,en,leak major bank 200k record include ssn,leak,0.2,0,credential_leak,credential_leak,False,0.0133399302465176
post_1459,buying combolist from university paying negotiable in bitcoin,hackforums,2024-01-08 02:20:00,en,buy combolist university pay negotiable bitcoin,bitcoin,0.2,2,unknown,unknown,False,0.0240005315855141
post_1460,fullz stuffing list government 100k checked bitcoin,exploit_in,2024-01-15 20:47:00,en,fullz stuff list government 100k check bitcoin,bitcoin,0.2,1,unknown,unknown,False,0.0230381537778953
post_1462,leak from ecommerce site 200k records includes account,breachforums,2024-03-14 16:39:00,en,leak ecommerce site 200k record include account,leak,0.2,0,credential_leak,credential_leak,False,0.0156670057772674
post_1464,exploit for windows kernel guaranteed 1000 usd escrow available,raidforums,2024-05-21 22:02:00,en,exploit windows kernel guarantee 1000 usd escrow available,exploit,0.2,6,zero_day,zero_day,False,0.0077808081711258
post_1465,selling 5k credit card from government 0.5 btc btc,breachforums,2024-06-07 11:50:00,en,sell 5k credit card government 05 btc btc,,0.0,5,unknown,unknown,False,0.0030856137049831
post_1466,ssn stuffing list healthcare provider 200k checked xmr,exploit_in,2024-03-05 16:07:00,en,ssn stuff list healthcare provider 200k check xmr,,0.0,1,unknown,unknown,False,0.0034910664552366
post_1467,phishing kit ecommerce site clone automated usdt,hackforums,2024-05-07 07:33:00,en,phishe kit ecommerce site clone automate usdt,,0.0,1,unknown,unknown,False,0.0224897130492319
post_1468,500k fullz from hospital verified monero,darknetlive,2024-06-27 12:39:00,en,500k fullz hospital verify monero,monero,0.2,0,unknown,unknown,False,0.0254447210283296
post_1470,500k fullz from ecommerce site verified xmr,raidforums,2024-04-09 09:40:00,en,500k fullz ecommerce site verify xmr,,0.0,0,unknown,unknown,False,0.0154797045346229
post_1471,fresh rat logs 10k lines silent install daily,raidforums,2024-06-20 02:30:00,en,fresh rat log 10k line silent install daily,rat,0.2,7,malware_sale,malware_sale,False,0.0172874107121799
post_1472,zero day in windows kernel automated unpatched selling bulk discount,darknetlive,2024-02-27 23:06:00,en,zero day windows kernel automate unpatched sell bulk discount,,0.0,2,unknown,unknown,False,0.0041047026262701
post_1473,spyware as a service modular monero only serious buyers,breachforums,2024-06-21 22:21:00,en,spyware service modular monero serious buyer,monero,0.2,4,unknown,unknown,False,0.0141424551560963
post_1474,malware builder persistent bypass apache server 0.5 btc,exploit_in,2024-01-24 03:45:00,en,malware builder persistent bypass apache server 05 btc,malware,0.2,9,malware_sale,malware_sale,False,0.0164773729602537
post_1475,buying fullz from social media paying negotiable in btc,hackforums,2024-01-24 20:43:00,en,buy fullz social medium pay negotiable btc,,0.0,2,unknown,unknown,False,0.0148527570461968
post_1476,buying ssn from hospital paying pm for price in xmr,breachforums,2024-01-09 23:04:00,en,buy ssn hospital pay pm price xmr,,0.0,2,unknown,unknown,False,0.0157708687122664
post_1477,phishing kit hospital clone guaranteed crypto,hackforums,2024-05-14 00:00:00,en,phishe kit hospital clone guarantee crypto,,0.0,1,unknown,unknown,False,0.0256072315569244
post_1478,ddos as a service bypass av xmr only serious buyers,breachforums,2024-02-02 19:33:00,en,ddos service bypass av xmr serious buyer,ddos,0.2,4,unknown,unknown,False,0.0078152829995546
post_1479,malware builder guaranteed bypass office365 bulk discount,breachforums,2024-06-05 11:08:00,en,malware builder guarantee bypass office365 bulk discount,malware,0.2,9,malware_sale,malware_sale,False,0.0259368585679353
post_1480,fresh fullz dump 1 million records healthcare provider btc accepted,hackforums,2024-05-18 09:14:00,en,fresh fullz dump 1 million record healthcare provider btc accept,dump,0.2,3,credential_leak,credential_leak,False,0.0234408212526338
post_1481,2 million database from major bank verified monero,exploit_in,2024-02-10 06:38:00,en,2 million database major bank verify monero,monero,0.2,3,unknown,unknown,False,0.0067363106212097
post_1482,leak from government 200k records includes fullz,breachforums,2024-01-20 02:16:00,en,leak government 200k record include fullz,leak,0.2,0,credential_leak,credential_leak,False,0.0175401783952191
post_1483,fresh ransomware logs 1 million lines tested daily,raidforums,2024-03-27 07:31:00,en,fresh ransomware log 1 million line test daily,"ransomware,ransom",0.4,7,ransomware,ransomware,False,0.0118640521372859
post_1484,5k credential from social media verified bitcoin,breachforums,2024-01-05 01:12:00,en,5k credential social medium verify bitcoin,"credential,bitcoin",0.4,0,credential_leak,credential_leak,False,0.0231908617498516
post_1485,leak from hospital 500k records includes database,breachforums,2024-02-09 21:29:00,en,leak hospital 500k record include database,leak,0.2,0,credential_leak,credential_leak,False,0.0174811750695925
post_1486,selling 5k ssn from hospital bulk discount bitcoin,hackforums,2024-05-23 20:57:00,en,sell 5k ssn hospital bulk discount bitcoin,bitcoin,0.2,2,unknown,unknown,False,0.0228043692651059
post_1487,malware source code silent install pm for price limited offer,exploit_in,2024-05-21 00:50:00,en,malware source code silent install pm price limit offer,malware,0.2,8,malware_sale,malware_sale,False,0.0056195429259383
post_1488,buying database from ecommerce site paying 500 usd in crypto,hackforums,2024-04-14 01:13:00,en,buy database ecommerce site pay 500 usd crypto,,0.0,2,unknown,unknown,False,0.0085805667018999
post_1489,access to major bank network encrypted negotiable usdt,darknetlive,2024-06-04 01:32:00,en,access major bank network encrypt negotiable usdt,,0.0,5,unknown,unknown,False,0.0139143630855321
post_1490,backdoor source code guaranteed pm for price limited offer,darknetlive,2024-05-26 12:55:00,en,backdoor source code guarantee pm price limit offer,backdoor,0.2,8,malware_sale,malware_sale,False,0.0060767333237802
post_1491,malware builder tested bypass web application 1000 usd,hackforums,2024-04-08 20:36:00,en,malware builder test bypass web application 1000 usd,malware,0.2,9,malware_sale,malware_sale,False,0.0201449723612579
post_1492,new rat available modular contact for negotiable,hackforums,2024-02-19 05:56:00,en,new rat available modular contact negotiable,rat,0.2,9,malware_sale,malware_sale,False,0.0091768026858934
post_1493,fresh credit card dump 200k records ecommerce site monero accepted,exploit_in,2024-05-23 01:26:00,en,fresh credit card dump 200k record ecommerce site monero accept,"dump,monero",0.4,3,credential_leak,credential_leak,False,0.0161069431301987
post_1494,fresh malware logs 50k lines encrypted daily,hackforums,2024-01-08 20:28:00,en,fresh malware log 50k line encrypt daily,malware,0.2,7,malware_sale,malware_sale,False,0.0195215600062199
post_1495,fresh crypter logs 500k lines modular daily,exploit_in,2024-03-24 21:42:00,en,fresh crypter log 500k line modular daily,,0.0,7,unknown,unknown,False,0.01370869667227
post_1496,phishing kit social media clone fud fully undetected usdt,breachforums,2024-01-01 11:26:00,en,phishe kit social medium clone fud fully undetected usdt,,0.0,1,unknown,unknown,False,0.0206473049431091
post_1497,new ddos available modular contact for bulk discount,raidforums,2024-05-19 21:09:00,en,new ddos available modular contact bulk discount,ddos,0.2,9,unknown,unknown,False,0.0089201277043011
post_1498,access to social media network tested 0.5 btc btc,hackforums,2024-06-10 02:59:00,en,access social medium network test 05 btc btc,,0.0,4,unknown,unknown,False,0.012106179124648
post_1499,selling 2 million logs from healthcare provider pm for price usdt,breachforums,2024-03-21 18:21:00,en,sell 2 million log healthcare provider pm price usdt,,0.0,2,unknown,unknown,False,0.0085055890274126
post_1500,zero day in android modular unpatched selling bulk discount,breachforums,2024-05-10 08:40:00,en,zero day android modular unpatched selling bulk discount,,0.0,2,unknown,unknown,False,0.0092952496939685
post_1501,5k logs from healthcare provider verified bitcoin,hackforums,2024-01-20 02:42:00,en,5k log healthcare provider verify bitcoin,bitcoin,0.2,1,unknown,unknown,False,0.0035780047247813
post_1502,malware builder fud fully undetected bypass web application negotiable,darknetlive,2024-06-14 08:05:00,en,malware builder fud fully undetected bypass web application negotiable,malware,0.2,6,malware_sale,malware_sale,False,0.0163481700307719
post_1503,access to major bank network automated 0.5 btc crypto,raidforums,2024-05-29 14:41:00,en,access major bank network automate 05 btc crypto,,0.0,5,unknown,unknown,False,0.0148056657973269
post_1504,access to university network no logs 500 usd usdt,exploit_in,2024-05-06 14:28:00,en,access university network log 500 usd usdt,,0.0,4,unknown,unknown,False,0.0096101708925189
post_1505,zero day in vpn client guaranteed unpatched selling pm for price,hackforums,2024-06-20 04:38:00,en,zero day vpn client guarantee unpatched sell pm price,,0.0,2,unknown,unknown,False,0.0089789203782767
post_1506,botnet as a service tested bitcoin only serious buyers,raidforums,2024-02-13 06:22:00,en,botnet service test bitcoin serious buyer,"botnet,bitcoin",0.4,4,unknown,unknown,False,0.0129092265856228
post_1507,fresh fullz dump 2 million records retailer monero accepted,raidforums,2024-06-03 05:00:00,en,fresh fullz dump 2 million record retailer monero accept,"dump,monero",0.4,3,credential_leak,credential_leak,False,0.0162336638562194
post_1508,fresh logs dump 500k records government btc accepted,darknetlive,2024-05-06 17:36:00,en,fresh log dump 500k record government btc accept,dump,0.2,3,credential_leak,credential_leak,False,0.0148704997914757
post_1509,100k credit card from government verified bitcoin,hackforums,2024-03-08 18:03:00,en,100k credit card government verify bitcoin,bitcoin,0.2,0,unknown,unknown,False,0.0155325211731642
post_1510,malware builder automated bypass windows kernel auction,darknetlive,2024-01-25 13:17:00,en,malware builder automate bypass windows kernel auction,malware,0.2,9,malware_sale,malware_sale,False,0.0172128887589305
post_1511,selling 500k account from government pm for price xmr,hackforums,2024-05-16 03:59:00,en,sell 500k account government pm price xmr,,0.0,2,unknown,unknown,False,0.0157000068988306
post_1512,phishing kit social media clone fud fully undetected monero,raidforums,2024-06-12 02:56:00,en,phishe kit social medium clone fud fully undetecte monero,monero,0.2,1,unknown,unknown,False,0.0175751182450951
post_1513,phishing kit government clone persistent btc,raidforums,2024-05-19 10:47:00,en,phishe kit government clone persistent btc,,0.0,1,unknown,unknown,False,0.018608700059849
post_1514,credit card stuffing list hospital 2 million checked monero,darknetlive,2024-05-11 05:34:00,en,credit card stuffing list hospital 2 million check monero,monero,0.2,5,unknown,unknown,False,0.0124111954641152
post_1515,ddos as a service automated bitcoin only serious buyers,hackforums,2024-01-22 21:53:00,en,ddos service automate bitcoin serious buyer,"ddos,bitcoin",0.4,4,unknown,unknown,False,0.0105000180246617
post_1516,new malware available guaranteed contact for pm for price,raidforums,2024-01-04 10:34:00,en,new malware available guarantee contact pm price,malware,0.2,9,malware_sale,malware_sale,False,0.0086414472763087
post_1517,phishing kit hospital clone automated monero,darknetlive,2024-01-19 18:08:00,en,phishe kit hospital clone automate monero,monero,0.2,1,unknown,unknown,False,0.0315843736731231
post_1518,backdoor source code automated negotiable limited offer,exploit_in,2024-03-01 13:39:00,en,backdoor source code automate negotiable limited offer,backdoor,0.2,8,malware_sale,malware_sale,False,0.0124941663872173
post_1519,leak from fortune 500 1 million records includes credential,exploit_in,2024-06-26 23:14:00,en,leak fortune 500 1 million record include credential,"credential,leak",0.4,0,credential_leak,credential_leak,False,0.0137017919649045
post_1520,account stuffing list healthcare provider 50k checked monero,hackforums,2024-04-24 12:30:00,en,account stuffing list healthcare provider 50k check monero,monero,0.2,1,unknown,unknown,False,0.0046264231374353
post_1521,leak from crypto exchange 200k records includes credential,raidforums,2024-01-17 23:40:00,en,leak crypto exchange 200k record include credential,"credential,leak",0.4,0,credential_leak,credential_leak,False,0.0171430935963927
post_1522,buying logs from social media paying 500 usd in btc,hackforums,2024-05-07 22:54:00,en,buy log social medium pay 500 usd btc,,0.0,2,unknown,unknown,False,0.0234497758822659
post_1523,malware builder fud fully undetected bypass database server bulk discount,breachforums,2024-03-22 21:33:00,en,malware builder fud fully undetected bypass database server bulk discount,malware,0.2,9,malware_sale,malware_sale,False,0.007731331591776
post_1524,200k credit card from university verified usdt,exploit_in,2024-04-09 12:46:00,en,200k credit card university verify usdt,,0.0,5,unknown,unknown,False,0.0256865680089171
post_1526,zero day in ios browser guaranteed unpatched selling 0.5 btc,exploit_in,2024-02-05 11:52:00,en,zero day ios browser guarantee unpatched sell 05 btc,,0.0,2,unknown,unknown,False,0.0088629621505328
post_1527,zero day in vpn client no logs unpatched selling pm for price,exploit_in,2024-02-26 06:34:00,en,zero day vpn client log unpatched sell pm price,,0.0,2,unknown,unknown,False,0.0018295569527428
post_1528,phishing kit hospital clone tested xmr,raidforums,2024-05-16 10:46:00,en,phishe kit hospital clone test xmr,,0.0,1,unknown,unknown,False,0.0266222477743865
post_1529,malware builder bypass av bypass ios browser bulk discount,raidforums,2024-05-09 03:35:00,en,malware builder bypass av bypass ios browser bulk discount,malware,0.2,9,malware_sale,malware_sale,False,0.007939184469238
post_1530,exploit for office365 automated bulk discount escrow available,raidforums,2024-01-05 19:20:00,en,exploit office365 automate bulk discount escrow available,exploit,0.2,6,zero_day,zero_day,False,0.020555738277168
post_1531,combolist stuffing list government 1 million checked monero,exploit_in,2024-06-21 16:52:00,en,combolist stuffing list government 1 million check monero,monero,0.2,1,unknown,unknown,False,0.0073606219963758
post_1532,fresh account dump 100k records crypto exchange monero accepted,hackforums,2024-06-29 10:37:00,en,fresh account dump 100k record crypto exchange monero accept,"dump,monero",0.4,3,credential_leak,credential_leak,False,0.0219332434729697
post_1533,zero day in office365 bypass av unpatched selling 500 usd,darknetlive,2024-03-16 14:06:00,en,zero day office365 bypass av unpatched sell 500 usd,,0.0,2,unknown,unknown,False,0.0114382204443937
post_1534,malware builder tested bypass web application 500 usd,exploit_in,2024-02-24 13:30:00,en,malware builder test bypass web application 500 usd,malware,0.2,9,malware_sale,malware_sale,False,0.0201212002752171
post_1535,fresh logs dump 500k records retailer xmr accepted,breachforums,2024-03-09 04:44:00,en,fresh log dump 500k record retailer xmr accept,dump,0.2,3,credential_leak,credential_leak,False,0.0151357559489588
post_1536,fresh credential dump 2 million records crypto exchange monero accepted,exploit_in,2024-04-02 04:15:00,en,fresh credential dump 2 million record crypto exchange monero accept,"credential,dump,monero",0.6,3,credential_leak,credential_leak,False,0.0229630390025577
post_1537,leak from fortune 500 10k records includes logs,exploit_in,2024-01-15 10:55:00,en,leak fortune 500 10k record include log,leak,0.2,0,credential_leak,credential_leak,False,0.0114569358760943
post_1538,leak from social media 5k records includes account,exploit_in,2024-05-06 22:21:00,en,leak social medium 5k record include account,leak,0.2,0,credential_leak,credential_leak,False,0.0230988629926322
post_1540,botnet source code fud fully undetected 1000 usd limited offer,darknetlive,2024-01-11 04:51:00,en,botnet source code fud fully undetecte 1000 usd limited offer,botnet,0.2,8,unknown,unknown,False,0.0081987937148647
post_1541,fresh credential dump 500k records university crypto accepted,exploit_in,2024-06-11 20:27:00,en,fresh credential dump 500k record university crypto accept,"credential,dump",0.4,3,credential_leak,credential_leak,False,0.022683955897502
post_1542,5k account from fortune 500 verified usdt,darknetlive,2024-06-12 14:46:00,en,5k account fortune 500 verify usdt,,0.0,0,unknown,unknown,False,0.0274924807337114
post_1543,access to major bank network persistent 500 usd xmr,exploit_in,2024-03-14 06:04:00,en,access major bank network persistent 500 usd xmr,,0.0,4,unknown,unknown,False,0.0098071626713477
post_1544,leak from ecommerce site 500k records includes logs,hackforums,2024-03-29 00:34:00,en,leak ecommerce site 500k record include log,leak,0.2,0,credential_leak,credential_leak,False,0.0080113825230552
post_1545,logs stuffing list social media 2 million checked bitcoin,darknetlive,2024-03-30 15:29:00,en,log stuff list social medium 2 million check bitcoin,bitcoin,0.2,1,unknown,unknown,False,0.013236627106075
post_1546,zero day in windows kernel modular unpatched selling 500 usd,breachforums,2024-03-24 04:39:00,en,zero day window kernel modular unpatched sell 500 usd,,0.0,2,unknown,unknown,False,0.0155771560286911
post_1547,leak from healthcare provider 200k records includes account,raidforums,2024-06-24 06:12:00,en,leak healthcare provider 200k record include account,leak,0.2,0,credential_leak,credential_leak,False,0.0139095017301776
post_1548,ssn stuffing list major bank 500k checked monero,raidforums,2024-05-25 19:13:00,en,ssn stuffing list major bank 500k check monero,monero,0.2,1,unknown,unknown,False,0.0079709375138527
post_1549,phishing kit hospital clone bypass av xmr,hackforums,2024-03-01 17:35:00,en,phishe kit hospital clone bypass av xmr,,0.0,1,unknown,unknown,False,0.0090650089304464
post_1550,backdoor as a service automated monero only serious buyers,darknetlive,2024-03-22 17:19:00,en,backdoor service automate monero serious buyer,"backdoor,monero",0.4,4,malware_sale,malware_sale,False,0.0133228989645178
post_1551,100k account from retailer verified usdt,breachforums,2024-04-10 09:15:00,en,100k account retailer verify usdt,,0.0,0,unknown,unknown,False,0.0263629117900149
post_1552,backdoor source code bypass av bulk discount limited offer,exploit_in,2024-04-24 19:52:00,en,backdoor source code bypass av bulk discount limited offer,backdoor,0.2,8,malware_sale,malware_sale,False,0.0246516982671192
post_1553,buying ssn from crypto exchange paying 500 usd in crypto,exploit_in,2024-03-25 07:42:00,en,buy ssn crypto exchange pay 500 usd crypto,,0.0,2,unknown,unknown,False,0.0140051873446646
post_1554,buying fullz from government paying 0.5 btc in usdt,hackforums,2024-05-22 16:15:00,en,buy fullz government pay 05 btc usdt,,0.0,2,unknown,unknown,False,0.0125888278598514
post_1555,new ddos available fud fully undetected contact for auction,breachforums,2024-02-18 05:02:00,en,new ddo available fud fully undetected contact auction,,0.0,9,unknown,unknown,False,0.017086252780922
post_1556,zero day in office365 encrypted unpatched selling bulk discount,darknetlive,2024-06-24 06:44:00,en,zero day office365 encrypt unpatched selling bulk discount,,0.0,2,unknown,unknown,False,0.0091064514813588
post_1557,access to government network fud fully undetected pm for price btc,darknetlive,2024-02-21 00:17:00,en,access government network fud fully undetected pm price btc,,0.0,6,unknown,unknown,False,0.0149831130706765
post_1558,keylogger as a service bypass av btc only serious buyers,hackforums,2024-01-18 11:53:00,en,keylogger service bypass av btc serious buyer,keylogger,0.2,4,malware_sale,malware_sale,False,0.0264512534615238
post_1559,botnet as a service modular btc only serious buyers,darknetlive,2024-06-18 00:05:00,en,botnet service modular btc serious buyer,botnet,0.2,4,unknown,unknown,False,0.0164050120852879
post_1560,backdoor as a service silent install bitcoin only serious buyers,breachforums,2024-05-27 13:30:00,en,backdoor service silent install bitcoin serious buyer,"backdoor,bitcoin",0.4,4,malware_sale,malware_sale,False,0.0113846337658088
post_1561,ddos as a service fud fully undetected monero only serious buyers,hackforums,2024-02-08 03:13:00,en,ddos service fud fully undetecte monero serious buyer,"ddos,monero",0.4,4,unknown,unknown,False,0.012872140370478
post_1562,fresh logs dump 2 million records retailer usdt accepted,breachforums,2024-06-04 23:43:00,en,fresh log dump 2 million record retailer usdt accept,dump,0.2,3,credential_leak,credential_leak,False,0.015884260471546
post_1563,fresh logs dump 100k records hospital monero accepted,raidforums,2024-06-07 23:02:00,en,fresh log dump 100k record hospital monero accept,"dump,monero",0.4,3,credential_leak,credential_leak,False,0.0172301200592413
post_1564,new stealer available fud fully undetected contact for 500 usd,raidforums,2024-05-26 06:27:00,en,new stealer available fud fully undetected contact 500 usd,stealer,0.2,9,malware_sale,malware_sale,False,0.0094038912230222
post_1565,exploit for apache server automated 0.5 btc escrow available,breachforums,2024-02-08 09:11:00,en,exploit apache server automate 05 btc escrow available,exploit,0.2,6,zero_day,zero_day,False,0.0178086650875974
post_1566,fresh credential dump 1 million records social media crypto accepted,darknetlive,2024-01-03 18:42:00,en,fresh credential dump 1 million record social medium crypto accept,"credential,dump",0.4,3,credential_leak,credential_leak,False,0.0206099500142293
post_1567,new backdoor available silent install contact for 500 usd,breachforums,2024-03-30 23:24:00,en,new backdoor available silent install contact 500 usd,backdoor,0.2,9,malware_sale,malware_sale,True,-0.0021521801559851
post_1568,credit card stuffing list crypto exchange 50k checked xmr,raidforums,2024-01-05 03:14:00,en,credit card stuffing list crypto exchange 50k check xmr,,0.0,1,unknown,unknown,False,0.0003862904496638
post_1569,fresh combolist dump 200k records government xmr accepted,hackforums,2024-04-03 12:19:00,en,fresh combolist dump 200k record government xmr accept,dump,0.2,3,credential_leak,credential_leak,False,0.0130692687641962
post_1570,ransomware as a service persistent monero only serious buyers,darknetlive,2024-01-14 13:07:00,en,ransomware service persistent monero serious buyer,"ransomware,monero,ransom",0.6,4,ransomware,ransomware,False,0.0253202345894908
post_1571,malware as a service tested usdt only serious buyers,breachforums,2024-03-07 05:52:00,en,malware service test usdt serious buyer,malware,0.2,4,malware_sale,malware_sale,False,0.0144916860658326
post_1572,ransomware as a service modular bitcoin only serious buyers,raidforums,2024-04-13 15:36:00,en,ransomware service modular bitcoin serious buyer,"ransomware,bitcoin,ransom",0.6,4,ransomware,ransomware,False,0.0204624932697335
post_1573,exploit for office365 modular negotiable escrow available,hackforums,2024-04-05 09:27:00,en,exploit office365 modular negotiable escrow available,exploit,0.2,6,zero_day,zero_day,False,0.0097018081706127
post_1574,spyware as a service guaranteed xmr only serious buyers,breachforums,2024-01-29 01:35:00,en,spyware service guarantee xmr serious buyer,,0.0,4,unknown,unknown,False,0.012047369643677
post_1575,fullz stuffing list major bank 100k checked bitcoin,darknetlive,2024-01-26 14:25:00,en,fullz stuffing list major bank 100k check bitcoin,bitcoin,0.2,1,unknown,unknown,False,0.0059644377963911
post_1576,account stuffing list fortune 500 100k checked btc,darknetlive,2024-05-12 03:51:00,en,account stuffing list fortune 500 100k check btc,,0.0,1,unknown,unknown,False,0.0129539148626064
post_1577,buying ssn from crypto exchange paying negotiable in usdt,exploit_in,2024-04-28 02:12:00,en,buy ssn crypto exchange pay negotiable usdt,,0.0,2,unknown,unknown,False,0.010890454834413
post_1578,selling 5k account from healthcare provider 500 usd bitcoin,darknetlive,2024-01-21 01:52:00,en,sell 5k account healthcare provider 500 usd bitcoin,bitcoin,0.2,2,unknown,unknown,False,0.017144418344615
post_1579,exploit for ios browser bypass av 500 usd escrow available,raidforums,2024-01-07 00:36:00,en,exploit ios browser bypass av 500 usd escrow available,exploit,0.2,6,zero_day,zero_day,False,0.0043852880329742
post_1580,new ddos available modular contact for 0.5 btc,breachforums,2024-05-07 00:13:00,en,new ddos available modular contact 05 btc,ddos,0.2,9,unknown,unknown,False,0.0069663345584661
post_1581,leak from government 50k records includes database,raidforums,2024-04-22 08:53:00,en,leak government 50k record include database,leak,0.2,0,credential_leak,credential_leak,False,0.0042455928625279
post_1582,phishing kit fortune 500 clone bypass av xmr,raidforums,2024-03-02 04:44:00,en,phishe kit fortune 500 clone bypass av xmr,,0.0,1,unknown,unknown,False,0.0023224154177144
