id,text,source_forum,timestamp,language,cleaned_text,keywords,risk_score,dominant_topic,label,threat_type,is_anomaly,anomaly_score
post_1054,2 million logs from hospital verified bitcoin,breachforums,2024-03-27 20:52:00,en,2 million log hospital verify bitcoin,bitcoin,0.2,0,unknown,unknown,False,0.0207649164244363
post_1055,zero day in apache server silent install unpatched selling bulk discount,hackforums,2024-06-06 19:21:00,en,zero day apache server silent install unpatched sell bulk discount,,0.0,2,unknown,unknown,True,-0.0023687331545743
post_1056,keylogger source code tested negotiable limited offer,exploit_in,2024-01-17 20:03:00,en,keylogger source code test negotiable limited offer,keylogger,0.2,8,malware_sale,malware_sale,False,0.0114804593031177
post_1057,ddos as a service silent install btc only serious buyers,raidforums,2024-02-11 11:21:00,en,ddos service silent install btc serious buyer,ddos,0.2,4,unknown,unknown,False,0.0144514244949898
post_1058,crypter as a service bypass av bitcoin only serious buyers,hackforums,2024-04-11 15:02:00,en,crypter service bypass av bitcoin serious buyer,bitcoin,0.2,4,unknown,unknown,False,0.028340866742305
post_1059,zero day in android fud fully undetected unpatched selling pm for price,raidforums,2024-02-01 12:41:00,en,zero day android fud fully undetecte unpatched sell pm price,,0.0,2,unknown,unknown,True,-0.0024839863597165
post_1060,new ddos available fud fully undetected contact for negotiable,hackforums,2024-05-18 19:58:00,en,new ddo available fud fully undetected contact negotiable,,0.0,9,unknown,unknown,False,0.013714650143446
post_1061,fresh credit card dump 5k records crypto exchange xmr accepted,raidforums,2024-01-06 09:17:00,en,fresh credit card dump 5k record crypto exchange xmr accept,dump,0.2,5,credential_leak,credential_leak,False,0.0107156913964947
post_1062,rat as a service guaranteed crypto only serious buyers,darknetlive,2024-02-26 13:35:00,en,rat service guarantee crypto serious buyer,rat,0.2,4,malware_sale,malware_sale,False,0.0211026519887825
post_1063,buying credit card from hospital paying negotiable in crypto,exploit_in,2024-01-28 14:14:00,en,buy credit card hospital pay negotiable crypto,,0.0,5,unknown,unknown,False,0.0137186943018449
post_1064,selling 5k credit card from retailer 1000 usd crypto,breachforums,2024-03-26 04:51:00,en,sell 5k credit card retailer 1000 usd crypto,,0.0,5,unknown,unknown,False,0.0139162970495337
post_1065,fresh credit card dump 200k records retailer monero accepted,exploit_in,2024-06-06 15:33:00,en,fresh credit card dump 200k record retailer monero accept,"dump,monero",0.4,3,credential_leak,credential_leak,False,0.0186468741868296
post_1066,credential stuffing list retailer 500k checked crypto,exploit_in,2024-01-10 10:44:00,en,credential stuffing list retailer 500k check crypto,credential,0.2,1,credential_leak,credential_leak,False,0.0068218790630279
post_1067,crypter source code encrypted pm for price limited offer,hackforums,2024-05-07 10:41:00,en,crypter source code encrypt pm price limit offer,,0.0,8,unknown,unknown,False,0.0126177310490663
post_1069,ssn stuffing list social media 50k checked bitcoin,raidforums,2024-01-30 01:56:00,en,ssn stuffing list social medium 50k check bitcoin,bitcoin,0.2,1,unknown,unknown,False,0.0190006927344681
post_1070,buying account from fortune 500 paying pm for price in btc,darknetlive,2024-03-16 03:27:00,en,buy account fortune 500 pay pm price btc,,0.0,2,unknown,unknown,False,0.0154997940409226
post_1071,fresh botnet logs 1 million lines persistent daily,exploit_in,2024-05-13 21:13:00,en,fresh botnet log 1 million line persistent daily,botnet,0.2,7,unknown,unknown,False,0.0037357836814941
post_1074,leak from healthcare provider 2 million records includes database,exploit_in,2024-01-18 11:40:00,en,leak healthcare provider 2 million record include database,leak,0.2,3,credential_leak,credential_leak,True,-0.0031387113541893
post_1075,phishing kit major bank clone guaranteed xmr,raidforums,2024-03-19 11:39:00,en,phishe kit major bank clone guarantee xmr,,0.0,1,unknown,unknown,False,0.0099760684303287
post_1076,phishing kit healthcare provider clone silent install monero,breachforums,2024-02-15 08:36:00,en,phishe kit healthcare provider clone silent install monero,monero,0.2,1,unknown,unknown,False,0.013945736825823
post_1077,new backdoor available no logs contact for auction,hackforums,2024-06-20 15:13:00,en,new backdoor available log contact auction,backdoor,0.2,9,malware_sale,malware_sale,False,0.0085846099201363
post_1078,selling 500k credit card from healthcare provider auction btc,breachforums,2024-05-01 00:20:00,en,sell 500k credit card healthcare provider auction btc,,0.0,5,unknown,unknown,False,0.0234535903216551
post_1079,phishing kit social media clone encrypted crypto,breachforums,2024-03-18 16:48:00,en,phishe kit social medium clone encrypt crypto,,0.0,1,unknown,unknown,False,0.0238450016462505
post_1080,keylogger as a service no logs crypto only serious buyers,exploit_in,2024-03-22 16:05:00,en,keylogger service log crypto serious buyer,keylogger,0.2,4,malware_sale,malware_sale,False,0.0172544115914096
post_1081,malware builder automated bypass router firmware pm for price,darknetlive,2024-05-05 22:50:00,en,malware builder automate bypass router firmware pm price,malware,0.2,9,malware_sale,malware_sale,False,0.0137963741993194
post_1082,access to university network encrypted 500 usd bitcoin,exploit_in,2024-04-18 06:39:00,en,access university network encrypt 500 usd bitcoin,bitcoin,0.2,4,unknown,unknown,False,0.0118350288563532
post_1083,phishing kit university clone silent install usdt,breachforums,2024-04-02 16:12:00,en,phishe kit university clone silent install usdt,,0.0,1,unknown,unknown,False,0.0114849906421129
post_1084,crypter source code fud fully undetected 1000 usd limited offer,darknetlive,2024-03-10 01:41:00,en,crypter source code fud fully undetecte 1000 usd limited offer,,0.0,8,unknown,unknown,False,0.0117565834100003
post_1085,access to major bank network no logs pm for price usdt,raidforums,2024-05-26 00:55:00,en,access major bank network log pm price usdt,,0.0,5,unknown,unknown,False,0.0032826605603067
post_1086,crypter source code bypass av 0.5 btc limited offer,hackforums,2024-04-04 00:39:00,en,crypter source code bypass av 05 btc limited offer,,0.0,8,unknown,unknown,False,0.0230305270612967
post_1087,fresh ransomware logs 200k lines encrypted daily,exploit_in,2024-03-21 03:54:00,en,fresh ransomware log 200k line encrypt daily,"ransomware,ransom",0.4,7,ransomware,ransomware,False,0.0096644523907853
post_1088,zero day in web application persistent unpatched selling auction,raidforums,2024-04-03 16:00:00,en,zero day web application persistent unpatched selling auction,,0.0,2,unknown,unknown,False,0.0046079421852022
post_1089,50k fullz from government verified btc,darknetlive,2024-02-14 14:02:00,en,50k fullz government verify btc,,0.0,0,unknown,unknown,False,0.0105221582717386
post_1090,ransomware source code no logs pm for price limited offer,darknetlive,2024-05-23 11:07:00,en,ransomware source code log pm price limit offer,"ransomware,ransom",0.4,8,ransomware,ransomware,False,0.0160164208132532
post_1091,buying account from healthcare provider paying negotiable in bitcoin,breachforums,2024-03-22 18:40:00,en,buy account healthcare provider pay negotiable bitcoin,bitcoin,0.2,2,unknown,unknown,False,0.0185817373417189
post_1092,credential stuffing list government 200k checked xmr,hackforums,2024-03-19 21:41:00,en,credential stuffing list government 200k check xmr,credential,0.2,1,credential_leak,credential_leak,False,0.0150201852148634
post_1093,fresh rat logs 200k lines persistent daily,raidforums,2024-02-05 18:20:00,en,fresh rat log 200k line persistent daily,rat,0.2,7,malware_sale,malware_sale,False,0.0100067347110859
post_1094,rat as a service encrypted xmr only serious buyers,exploit_in,2024-01-24 15:22:00,en,rat service encrypt xmr serious buyer,rat,0.2,4,malware_sale,malware_sale,False,0.0191660448596859
post_1096,exploit for apache server no logs pm for price escrow available,hackforums,2024-05-11 06:16:00,en,exploit apache server log pm price escrow available,exploit,0.2,6,zero_day,zero_day,False,0.0168277910023189
post_1097,buying credential from healthcare provider paying bulk discount in usdt,darknetlive,2024-04-29 18:20:00,en,buy credential healthcare provider pay bulk discount usdt,credential,0.2,2,credential_leak,credential_leak,False,0.0143737580356019
post_1098,keylogger source code fud fully undetected pm for price limited offer,darknetlive,2024-04-17 15:21:00,en,keylogger source code fud fully undetected pm price limit offer,keylogger,0.2,8,malware_sale,malware_sale,True,-0.0009898303895452
post_1099,access to university network automated 1000 usd monero,exploit_in,2024-01-06 14:51:00,en,access university network automate 1000 usd monero,monero,0.2,4,unknown,unknown,False,0.0200141570576211
post_1100,buying logs from retailer paying auction in monero,raidforums,2024-03-27 15:43:00,en,buy log retailer pay auction monero,monero,0.2,2,unknown,unknown,False,0.0183230597538164
post_1101,zero day in web application no logs unpatched selling negotiable,hackforums,2024-04-12 18:01:00,en,zero day web application log unpatched sell negotiable,,0.0,2,unknown,unknown,True,-0.0014728315364793
post_1102,leak from crypto exchange 200k records includes combolist,breachforums,2024-02-03 21:21:00,en,leak crypto exchange 200k record include combolist,leak,0.2,0,credential_leak,credential_leak,False,0.0172246381799622
post_1103,fresh ssn dump 1 million records university crypto accepted,hackforums,2024-06-17 04:12:00,en,fresh ssn dump 1 million record university crypto accept,dump,0.2,3,credential_leak,credential_leak,False,0.009962040300897
post_1104,zero day in ios browser bypass av unpatched selling 500 usd,darknetlive,2024-02-09 21:35:00,en,zero day ios browser bypass av unpatched sell 500 usd,,0.0,2,unknown,unknown,False,0.0089635584595764
post_1105,selling 2 million ssn from university negotiable crypto,raidforums,2024-04-30 21:24:00,en,sell 2 million ssn university negotiable crypto,,0.0,5,unknown,unknown,False,0.0250455231786247
post_1106,fresh botnet logs 500k lines guaranteed daily,raidforums,2024-03-13 21:46:00,en,fresh botnet log 500k line guarantee daily,botnet,0.2,7,unknown,unknown,False,0.0101025633876215
post_1107,backdoor source code fud fully undetected 0.5 btc limited offer,hackforums,2024-06-04 05:49:00,en,backdoor source code fud fully undetecte 05 btc limited offer,backdoor,0.2,8,malware_sale,malware_sale,False,0.0082570789740337
post_1109,buying credential from government paying 1000 usd in crypto,hackforums,2024-06-16 05:27:00,en,buy credential government pay 1000 usd crypto,credential,0.2,2,credential_leak,credential_leak,False,0.0130347673319918
post_1110,zero day in wordpress persistent unpatched selling negotiable,breachforums,2024-04-11 21:33:00,en,zero day wordpress persistent unpatched sell negotiable,,0.0,2,unknown,unknown,False,0.0075698793312857
post_1111,buying database from healthcare provider paying pm for price in crypto,raidforums,2024-02-02 18:32:00,en,buy database healthcare provider pay pm price crypto,,0.0,2,unknown,unknown,False,0.0084435815838565
post_1112,access to retailer network guaranteed pm for price usdt,breachforums,2024-03-18 13:16:00,en,access retailer network guarantee pm price usdt,,0.0,5,unknown,unknown,False,0.0177224169580689
post_1113,crypter source code tested pm for price limited offer,raidforums,2024-02-15 13:34:00,en,crypter source code test pm price limit offer,,0.0,8,unknown,malware_sale,False,0.0130360334914551
post_1114,malware builder no logs bypass ios browser 1000 usd,raidforums,2024-05-11 19:46:00,en,malware builder log bypass ios browser 1000 usd,malware,0.2,9,malware_sale,malware_sale,False,0.0139602848036589
post_1115,50k account from ecommerce site verified bitcoin,darknetlive,2024-01-13 19:43:00,en,50k account ecommerce site verify bitcoin,bitcoin,0.2,0,unknown,unknown,False,0.0192371329908868
post_1116,zero day in wordpress no logs unpatched selling auction,breachforums,2024-03-16 11:26:00,en,zero day wordpress log unpatched selling auction,,0.0,2,unknown,unknown,False,0.0075930922679446
post_1117,buying combolist from major bank paying bulk discount in bitcoin,breachforums,2024-04-11 07:11:00,en,buy combolist major bank pay bulk discount bitcoin,bitcoin,0.2,2,unknown,unknown,False,0.0134734379086474
post_1118,leak from fortune 500 100k records includes ssn,hackforums,2024-04-27 22:39:00,en,leak fortune 500 100k record include ssn,leak,0.2,0,credential_leak,credential_leak,False,0.0235538464041616
post_1119,phishing kit healthcare provider clone persistent xmr,exploit_in,2024-06-12 03:24:00,en,phishe kit healthcare provider clone persistent xmr,,0.0,1,unknown,unknown,False,0.0097311797853029
post_1120,fresh backdoor logs 100k lines no logs daily,hackforums,2024-06-06 16:34:00,en,fresh backdoor log 100k line log daily,backdoor,0.2,7,malware_sale,malware_sale,False,0.0072002941141752
post_1121,fresh ddos logs 50k lines no logs daily,breachforums,2024-03-11 16:42:00,en,fresh ddos log 50k line log daily,ddos,0.2,7,unknown,unknown,False,0.010216225186363
post_1122,ddos source code silent install 1000 usd limited offer,darknetlive,2024-04-16 21:08:00,en,ddos source code silent install 1000 usd limited offer,ddos,0.2,8,unknown,unknown,False,0.0144244470109499
post_1123,zero day in ios browser tested unpatched selling 500 usd,exploit_in,2024-01-17 19:18:00,en,zero day ios browser test unpatched sell 500 usd,,0.0,2,unknown,unknown,False,0.0049698214200811
post_1124,malware builder encrypted bypass database server 1000 usd,darknetlive,2024-01-04 10:21:00,en,malware builder encrypt bypass database server 1000 usd,malware,0.2,9,malware_sale,malware_sale,False,0.0088072530772564
post_1126,fresh spyware logs 10k lines encrypted daily,hackforums,2024-02-09 19:37:00,en,fresh spyware log 10k line encrypt daily,,0.0,7,unknown,unknown,False,0.01532116821146
post_1127,rat source code automated auction limited offer,exploit_in,2024-03-01 12:58:00,en,rat source code automate auction limited offer,rat,0.2,8,malware_sale,malware_sale,False,0.0262586308654676
post_1128,new stealer available bypass av contact for 0.5 btc,hackforums,2024-03-15 05:55:00,en,new stealer available bypass av contact 05 btc,stealer,0.2,9,malware_sale,malware_sale,False,0.0022965416892102
post_1129,logs stuffing list university 5k checked monero,breachforums,2024-03-22 11:40:00,en,log stuff list university 5k check monero,monero,0.2,1,unknown,unknown,False,0.0127909045897791
post_1130,access to government network encrypted auction crypto,hackforums,2024-04-25 05:59:00,en,access government network encrypt auction crypto,,0.0,5,unknown,unknown,False,0.0160997222267291
post_1131,1 million credential from social media verified xmr,raidforums,2024-04-08 18:41:00,en,1 million credential social medium verify xmr,credential,0.2,0,credential_leak,credential_leak,False,0.0214094918197461
post_1132,5k credit card from major bank verified monero,exploit_in,2024-05-08 02:38:00,en,5k credit card major bank verify monero,monero,0.2,5,unknown,unknown,False,0.011894972742134
post_1133,fresh botnet logs 5k lines modular daily,breachforums,2024-06-24 02:23:00,en,fresh botnet log 5k line modular daily,botnet,0.2,7,unknown,unknown,False,0.0040528920656023
post_1135,fresh credit card dump 50k records crypto exchange crypto accepted,exploit_in,2024-03-02 05:29:00,en,fresh credit card dump 50k record crypto exchange crypto accept,dump,0.2,3,credential_leak,credential_leak,False,0.0005334229702109
post_1136,access to fortune 500 network fud fully undetected 500 usd crypto,exploit_in,2024-06-23 21:26:00,en,access fortune 500 network fud fully undetecte 500 usd crypto,,0.0,5,unknown,unknown,True,-0.0018320945414393
post_1137,buying fullz from hospital paying 1000 usd in usdt,breachforums,2024-06-14 17:45:00,en,buy fullz hospital pay 1000 usd usdt,,0.0,2,unknown,unknown,False,0.0120443030933928
post_1138,buying credential from ecommerce site paying auction in crypto,raidforums,2024-05-10 20:41:00,en,buy credential ecommerce site pay auction crypto,credential,0.2,2,credential_leak,credential_leak,False,0.0156545991542008
post_1140,new keylogger available bypass av contact for 1000 usd,darknetlive,2024-05-05 07:48:00,en,new keylogger available bypass av contact 1000 usd,keylogger,0.2,9,malware_sale,malware_sale,False,0.0010929575022226
post_1142,new keylogger available no logs contact for 1000 usd,darknetlive,2024-02-10 18:40:00,en,new keylogger available log contact 1000 usd,keylogger,0.2,9,malware_sale,malware_sale,False,0.006381067994426
post_1143,buying combolist from fortune 500 paying pm for price in usdt,hackforums,2024-03-15 12:16:00,en,buy combolist fortune 500 pay pm price usdt,,0.0,2,unknown,unknown,False,0.0105831090599484
post_1144,selling 500k combolist from fortune 500 bulk discount bitcoin,exploit_in,2024-05-12 12:30:00,en,sell 500k combolist fortune 500 bulk discount bitcoin,bitcoin,0.2,2,unknown,unknown,False,0.0197724716537066
post_1145,phishing kit fortune 500 clone automated btc,hackforums,2024-04-06 15:41:00,en,phishe kit fortune 500 clone automate btc,,0.0,1,unknown,unknown,False,0.0274708394497498
post_1146,malware builder tested bypass ios browser 0.5 btc,hackforums,2024-03-20 06:14:00,en,malware builder test bypass ios browser 05 btc,malware,0.2,9,malware_sale,malware_sale,False,0.0085056172054324
post_1147,zero day in database server fud fully undetected unpatched selling 0.5 btc,darknetlive,2024-02-28 23:12:00,en,zero day database server fud fully undetected unpatched sell 05 btc,,0.0,2,unknown,unknown,False,0.0060585213949355
post_1148,access to healthcare provider network no logs 1000 usd btc,breachforums,2024-05-16 23:34:00,en,access healthcare provider network log 1000 usd btc,,0.0,2,unknown,unknown,False,0.0076705110388663
post_1149,account stuffing list crypto exchange 50k checked monero,hackforums,2024-06-25 20:54:00,en,account stuff list crypto exchange 50k check monero,monero,0.2,1,unknown,unknown,False,0.001740785420211
post_1150,crypter as a service no logs xmr only serious buyers,breachforums,2024-02-18 23:53:00,en,crypter service log xmr serious buyer,,0.0,4,unknown,unknown,False,0.0175870664245736
post_1151,phishing kit major bank clone modular monero,exploit_in,2024-05-02 14:06:00,en,phishe kit major bank clone modular monero,monero,0.2,1,unknown,unknown,False,0.0198299220042438
post_1152,phishing kit healthcare provider clone encrypted crypto,exploit_in,2024-05-01 06:06:00,en,phishe kit healthcare provider clone encrypt crypto,,0.0,1,unknown,unknown,False,0.020574147040457
post_1153,backdoor source code guaranteed bulk discount limited offer,exploit_in,2024-04-23 20:12:00,en,backdoor source code guarantee bulk discount limited offer,backdoor,0.2,8,malware_sale,malware_sale,False,0.0207113741046777
post_1154,credential stuffing list ecommerce site 2 million checked crypto,exploit_in,2024-06-10 05:21:00,en,credential stuffing list ecommerce site 2 million check crypto,credential,0.2,0,credential_leak,credential_leak,True,-0.0009867521548304
post_1155,buying combolist from ecommerce site paying auction in btc,darknetlive,2024-06-22 17:32:00,en,buy combolist ecommerce site pay auction btc,,0.0,2,unknown,unknown,False,0.0196735511154554
post_1156,access to fortune 500 network automated 0.5 btc bitcoin,breachforums,2024-05-06 05:11:00,en,access fortune 500 network automate 05 btc bitcoin,bitcoin,0.2,5,unknown,unknown,False,0.0175367095185303
post_1157,combolist stuffing list healthcare provider 5k checked crypto,hackforums,2024-02-19 03:48:00,en,combolist stuffing list healthcare provider 5k check crypto,,0.0,1,unknown,unknown,True,-0.0044749616049412
post_1158,spyware as a service bypass av btc only serious buyers,hackforums,2024-06-05 06:36:00,en,spyware service bypass av btc serious buyer,,0.0,4,unknown,unknown,False,0.0212178879993918
post_1159,exploit for wordpress modular auction escrow available,exploit_in,2024-03-24 16:30:00,en,exploit wordpress modular auction escrow available,exploit,0.2,6,zero_day,zero_day,False,0.0133686120419919
post_1160,combolist stuffing list government 5k checked crypto,darknetlive,2024-03-19 10:46:00,en,combolist stuffing list government 5k check crypto,,0.0,1,unknown,unknown,False,0.0063835076827549
post_1161,malware builder guaranteed bypass windows kernel 0.5 btc,darknetlive,2024-04-13 01:26:00,en,malware builder guarantee bypass windows kernel 05 btc,malware,0.2,9,malware_sale,malware_sale,False,0.0044515766283387
post_1162,access to ecommerce site network silent install negotiable usdt,darknetlive,2024-03-16 11:01:00,en,access ecommerce site network silent install negotiable usdt,,0.0,5,unknown,unknown,False,0.0118142657647116
post_1163,5k database from social media verified usdt,darknetlive,2024-05-08 14:54:00,en,5k database social medium verify usdt,,0.0,0,unknown,unknown,False,0.0015152683139216
post_1164,fresh credit card dump 100k records fortune 500 usdt accepted,raidforums,2024-01-12 21:24:00,en,fresh credit card dump 100k record fortune 500 usdt accept,dump,0.2,3,credential_leak,credential_leak,False,0.0100628554154437
post_1165,keylogger as a service no logs bitcoin only serious buyers,darknetlive,2024-04-04 14:59:00,en,keylogger service log bitcoin serious buyer,"keylogger,bitcoin",0.4,4,malware_sale,malware_sale,False,0.0166895177713876
post_1166,fresh ssn dump 2 million records healthcare provider usdt accepted,hackforums,2024-05-30 09:36:00,en,fresh ssn dump 2 million record healthcare provider usdt accept,dump,0.2,3,credential_leak,credential_leak,False,0.0084214293905273
post_1167,leak from government 100k records includes account,breachforums,2024-05-15 09:44:00,en,leak government 100k record include account,leak,0.2,0,credential_leak,credential_leak,False,0.023669600163993
post_1168,new stealer available persistent contact for auction,darknetlive,2024-04-29 07:29:00,en,new stealer available persistent contact auction,stealer,0.2,9,malware_sale,malware_sale,False,0.0098339268702111
post_1169,exploit for apache server persistent bulk discount escrow available,raidforums,2024-06-13 13:27:00,en,exploit apache server persistent bulk discount escrow available,exploit,0.2,6,zero_day,zero_day,False,0.0176832960176067
post_1170,credential stuffing list social media 2 million checked btc,darknetlive,2024-04-21 01:32:00,en,credential stuffing list social medium 2 million check btc,credential,0.2,1,credential_leak,credential_leak,False,0.0060772249306377
post_1171,combolist stuffing list crypto exchange 2 million checked usdt,breachforums,2024-01-24 17:49:00,en,combolist stuffing list crypto exchange 2 million check usdt,,0.0,1,unknown,unknown,True,-0.0062444726984721
post_1172,leak from crypto exchange 200k records includes fullz,hackforums,2024-03-11 14:28:00,en,leak crypto exchange 200k record include fullz,leak,0.2,0,credential_leak,credential_leak,False,0.0161014135025295
post_1173,access to fortune 500 network encrypted pm for price btc,raidforums,2024-06-26 23:52:00,en,access fortune 500 network encrypt pm price btc,,0.0,5,unknown,unknown,False,0.0140796396132217
post_1174,phishing kit crypto exchange clone guaranteed bitcoin,raidforums,2024-01-03 07:20:00,en,phishe kit crypto exchange clone guarantee bitcoin,bitcoin,0.2,1,unknown,unknown,False,0.0086459108934597
post_1175,new crypter available encrypted contact for pm for price,exploit_in,2024-05-27 11:57:00,en,new crypter available encrypt contact pm price,,0.0,9,unknown,unknown,False,0.0146947650128012
post_1176,new malware available fud fully undetected contact for 1000 usd,hackforums,2024-06-03 01:49:00,en,new malware available fud fully undetected contact 1000 usd,malware,0.2,9,malware_sale,malware_sale,False,0.0032069590883388
post_1177,leak from university 10k records includes fullz,darknetlive,2024-03-18 05:27:00,en,leak university 10k record include fullz,leak,0.2,0,credential_leak,credential_leak,False,0.0139402359716141
post_1178,malware as a service guaranteed crypto only serious buyers,hackforums,2024-04-23 23:54:00,en,malware service guarantee crypto serious buyer,malware,0.2,4,malware_sale,malware_sale,False,0.0176076592463615
post_1179,50k account from retailer verified monero,exploit_in,2024-02-01 02:11:00,en,50k account retailer verify monero,monero,0.2,0,unknown,unknown,False,0.0204384142786251
post_1180,500k credit card from healthcare provider verified btc,breachforums,2024-05-10 03:29:00,en,500k credit card healthcare provider verify btc,,0.0,5,unknown,unknown,False,0.0093864740441921
post_1181,selling 5k logs from hospital auction bitcoin,darknetlive,2024-01-17 13:54:00,en,sell 5k log hospital auction bitcoin,bitcoin,0.2,5,unknown,unknown,False,0.0261803211415374
post_1182,keylogger as a service fud fully undetected xmr only serious buyers,breachforums,2024-03-04 05:36:00,en,keylogger service fud fully undetected xmr serious buyer,keylogger,0.2,4,malware_sale,malware_sale,False,0.0091812079311676
post_1183,new ransomware available modular contact for auction,exploit_in,2024-06-18 09:23:00,en,new ransomware available modular contact auction,"ransomware,ransom",0.4,9,ransomware,ransomware,False,0.0111599849470443
post_1185,backdoor as a service tested xmr only serious buyers,raidforums,2024-01-07 10:01:00,en,backdoor service test xmr serious buyer,backdoor,0.2,4,malware_sale,malware_sale,False,0.0079628685502254
post_1186,selling 200k logs from major bank bulk discount crypto,darknetlive,2024-02-10 03:00:00,en,sell 200k log major bank bulk discount crypto,,0.0,2,unknown,unknown,False,0.0201524593370187
post_1187,phishing kit hospital clone encrypted bitcoin,exploit_in,2024-05-17 14:08:00,en,phishe kit hospital clone encrypt bitcoin,bitcoin,0.2,1,unknown,unknown,False,0.032530329390349
